{
  "agent": "dsp-agent",
  "status": "success",
  "outputs": {
    "plugin_name": "MicroMarimba",
    "complexity": 5.0,
    "phase_completed": "2.4",
    "phases_total": 4,
    "all_phases_complete": true,
    "phase_description": "Body resonance (convolution-based tube simulation)",
    "components_this_phase": [
      "BodyResonance class with juce::dsp::Convolution",
      "juce::dsp::DryWetMixer for wet/dry blend",
      "Synthetic IR generator (75ms, 300/500/750 Hz resonances)",
      "RESONANCE parameter dual-purpose integration"
    ],
    "total_components": 4,
    "total_parameters_connected": 7,
    "real_time_safe": true,
    "files_created": [
      "plugins/MicroMarimba/Source/BodyResonance.h",
      "plugins/MicroMarimba/Source/BodyResonance.cpp"
    ],
    "files_modified": [
      "plugins/MicroMarimba/Source/PluginProcessor.h",
      "plugins/MicroMarimba/Source/PluginProcessor.cpp",
      "plugins/MicroMarimba/CMakeLists.txt",
      "plugins/MicroMarimba/.continue-here.md"
    ],
    "processing_chain": "Input → Synth (8-mode modal) → Body Resonance (Convolution) → Output Gain → Stereo Output",
    "dsp_features": [
      "Synthetic IR generation (exponential decay, 3 resonant modes)",
      "Convolution with stereo support",
      "Dry/wet mixing with balanced rule",
      "RESONANCE parameter scales to 50% wet max",
      "IR normalization for consistent levels"
    ]
  },
  "issues": [],
  "ready_for_next_stage": true,
  "stateUpdated": true
}
